Rank,Author,Title,Citations,Year,Publisher,Venue,Source,cit/year
43,"B Langmead, C Trapnell, M Pop, SL Salzberg",Ultrafast and memory-efficient alignment of short DNA sequences to the human genome,23954,2009, Springer, Genome biology,https://link.springer.com/article/10.1186/Gb-2009-10-3-R25,1497
44,"SR Gill, M Pop, RT DeBoy, PB Eckburg, PJ Turnbaugh…",Metagenomic analysis of the human distal gut microbiome,5920,2006, science.org, science,https://www.science.org/doi/abs/10.1126/science.1124234,312
28,"AM Pisoschi, A Pop",The role of antioxidants in the chemistry of oxidative stress: A review,3156,2015, Elsevier, European journal of medicinal chemistry,https://www.sciencedirect.com/science/article/pii/S0223523415300039,316
54,"R Pop-Busui, AJM Boulton, EL Feldman, V Bril…",Diabetic neuropathy: a position statement by the American Diabetes Association,2700,2017, ncbi.nlm.nih.gov, Diabetes …,https://www.ncbi.nlm.nih.gov/pmc/articles/PMC6977405/,338
48,"WA Khan, I Pop",Boundary-layer flow of a nanofluid past a stretching sheet,2578,2010, Elsevier, International journal of heat and mass transfer,https://www.sciencedirect.com/science/article/pii/S001793101000044X,172
49,"E Pop, D Mann, Q Wang, K Goodson, H Dai",Thermal conductance of an individual single-wall carbon nanotube above room temperature,2476,2006, ACS Publications, Nano letters,https://pubs.acs.org/doi/abs/10.1021/nl052145f,130
55,"JN Paulson, OC Stine, HC Bravo, M Pop",Differential abundance analysis for microbial marker-gene surveys,2267,2013, nature.com, Nature methods,https://www.nature.com/articles/nmeth.2658,189
53,"…, I Nyklíček, H Riper, J Keyzer, V Pop",Internet-based cognitive behaviour therapy for symptoms of depression and anxiety: a meta-analysis,2136,2007, cambridge.org, Psychological …,https://www.cambridge.org/core/journals/psychological-medicine/article/internetbased-cognitive-behaviour-therapy-for-symptoms-of-depression-and-anxiety-a-metaanalysis/251608942E066BB9F3F0335341B65CDF,119
10,"KC Jones, P De Voogt",Persistent organic pollutants (POPs): state of the science,2112,1999, Elsevier, Environmental pollution,https://www.sciencedirect.com/science/article/pii/S0269749199000986,81
19,P Krugman,Could not catch title,2010,1996, MIT Press,,"Look manually at: https://scholar.google.com/scholar?start=10&q=POP&hl=en&as_sdt=0,5",69
52,"E Pop, V Varshney, AK Roy",Thermal properties of graphene: Fundamentals and applications,1984,2012, cambridge.org, MRS bulletin,https://www.cambridge.org/core/journals/mrs-bulletin/article/thermal-properties-of-graphene-fundamentals-and-applications/999F0B6C6878366C0870BBC5F6A33DEE,153
34,"DB Ingham, I Pop",Transport phenomena in porous media,1980,1998, books.google.com,,https://books.google.com/books?hl=en&lr=&id=7RJBAQAAQBAJ&oi=fnd&pg=PP1&dq=POP&ots=O15mMPcbCt&sig=AwjDXtnhUT3XQ8ByxhpNWnPrpKg,73
56,"…, A Majumdar, HJ Maris, SR Phillpot, E Pop…",Nanoscale thermal transport. II. 2003–2012,1874,2014, pubs.aip.org, Applied physics …,https://pubs.aip.org/aip/apr/article/1/1/011305/123940,170
62,"…, D Karl, L Katz, A Krikorian, P O'Connor, R Pop-Busui…",Effect of intensive treatment of hyperglycaemia on microvascular outcomes in type 2 diabetes: an analysis of the ACCORD randomised trial,1840,2010, thelancet.com, The Lancet,https://www.thelancet.com/journals/lancet/article/PIIS0140-6736(10)60576-4/fulltext?code=lancet-site&r..=,123
45,S Reynolds,Could not catch title,1806,2011, Macmillan,,"Look manually at: https://scholar.google.com/scholar?start=40&q=POP&hl=en&as_sdt=0,5",129
57,"…, G Pai, M Parsons, M Pentony, U Pettersson, M Pop…","The Genome Sequence of Trypanosoma cruzi, Etiologic Agent of Chagas Disease",1806,2005, science.org, Science,https://www.science.org/doi/abs/10.1126/science.1112631,90
58,"…, DE Fouts, SR Gill, M Pop…",Complete genome sequence and comparative analysis of the metabolically versatile Pseudomonas putida KT2440,1657,2002, Wiley Online Library, Environmental …,https://enviromicro-journals.onlinelibrary.wiley.com/doi/abs/10.1046/j.1462-2920.2002.00366.x,72
59,"JR White, N Nagarajan, M Pop",Statistical methods for detecting differentially abundant features in clinical metagenomic samples,1631,2009, journals.plos.org, PLoS computational biology,https://journals.plos.org/ploscompbiol/article?id=10.1371/journal.pcbi.1000352,102
73,"EL Feldman, BC Callaghan, R Pop-Busui…",Diabetic neuropathy,1618,2019, nature.com, Nature reviews Disease …,https://www.nature.com/articles/s41572-019-0092-1/1000,270
65,"…, S Dallongeville, N Chenouard, N Hervé, S Pop…",Icy: an open bioimage informatics platform for extended reproducible research,1601,2012, nature.com, Nature …,https://www.nature.com/articles/nmeth.2075,123
39,TD Taylor,"Global pop: World music, world markets",1489,2014, taylorfrancis.com,,https://www.taylorfrancis.com/books/mono/10.4324/9780203949207/global-pop-timothy-taylor,135
66,"O Mahian, A Kianifar, SA Kalogirou, I Pop…",A review of the applications of nanofluids in solar energy,1421,2013, Elsevier, International Journal of …,https://www.sciencedirect.com/science/article/pii/S0017931012008034,118
80,E Pop,Energy dissipation and transport in nanoscale devices,1404,2010, Springer, Nano Research,https://link.springer.com/article/10.1007/s12274-010-1019-z,94
67,"B Liu, M Pop",ARDB—antibiotic resistance genes database,1396,2009, academic.oup.com, Nucleic acids research,https://academic.oup.com/nar/article-abstract/37/suppl_1/D443/1002454,87
78,"RS Scott, EJ McMahon, SM Pop, EA Reap, R Caricchio…",Phagocytosis and clearance of apoptotic cells is mediated by MER,1395,2001, nature.com, Nature,https://www.nature.com/articles/35075603,58
71,"…, R Weinlich, LL McCormick, P Fitzgerald, C Pop…",Catalytic activity of the caspase-8–FLIPL complex inhibits RIPK3-dependent necrosis,1366,2011, nature.com, Nature,https://www.nature.com/articles/nature09852,98
69,"VJ Pop, JL Kuijpens, AL van Baar…",Low maternal free thyroxine concentrations during early pregnancy are associated with impaired psychomotor development in infancy,1342,1999, Wiley Online Library, Clinical …,https://onlinelibrary.wiley.com/doi/abs/10.1046/j.1365-2265.1999.00639.x,52
42,"I Pop, DB Ingham",Convective heat transfer: mathematical and computational modelling of viscous fluids and porous media,1274,2001, books.google.com,,https://books.google.com/books?hl=en&lr=&id=lvyDVQtqF4AC&oi=fnd&pg=PP1&dq=POP&ots=gGJHJuMsbk&sig=e-UFHqt7jSl95YLg0f4aK4gNgN0,53
77,"C Pop-Eleches, H Thirumurthy, JP Habyarimana…",Mobile phone technologies improve adherence to antiretroviral treatment in a resource-limited setting: a randomized controlled trial of text message reminders,1232,2011, journals.lww.com, Aids,https://journals.lww.com/aidsonline/fulltext/2011/03270/Mobile_phone_technologies_improve_adherence_to.13.aspx,88
81,"…, F Lopez-de-Silanes, C Pop-Eleches…",Judicial checks and balances,1212,2004, journals.uchicago.edu, Journal of Political …,https://www.journals.uchicago.edu/doi/abs/10.1086/381480,58
86,"…, L Bernardi, S Frontoni, R Pop‐Busui…","Cardiovascular autonomic neuropathy in diabetes: clinical impact, assessment, diagnosis, and management",1117,2011, Wiley Online Library, Diabetes/metabolism …,https://onlinelibrary.wiley.com/doi/abs/10.1002/dmrr.1239,80
79,"PA Adlard, VM Perreau, V Pop…",Voluntary exercise decreases amyloid load in a transgenic model of Alzheimer's disease,1113,2005, Soc Neuroscience, Journal of …,https://www.jneurosci.org/content/25/17/4217.short,56
75,"VJ Pop, EP Brouwers, HL Vader, T Vulsma…",Maternal hypothyroxinaemia during early pregnancy and subsequent child development: a 3‐year follow‐up study,1078,2003, Wiley Online Library, Clinical …,https://onlinelibrary.wiley.com/doi/abs/10.1046/j.1365-2265.2003.01822.x,49
8,"C Pop, GS Salvesen","Human caspases: activation, specificity, and regulation",1001,2009, ASBMB, Journal of biological Chemistry,https://www.jbc.org/article/S0021-9258(18)49383-0/abstract,63
85,"…, AS Durkin, DH Haft, WC Nelson, JD Peterson, M Pop…",The genome sequence of Bacillus anthracis Ames and comparison to closely related bacteria,999,2003, nature.com, Nature,https://www.nature.com/articles/nature01586,45
83,"…, RP Hirt, BJ Mann, T Nozaki, B Suh, M Pop…",The genome of the protist parasite Entamoeba histolytica,992,2005, nature.com, Nature,https://www.nature.com/articles/nature03291,50
14,"D Hoiem, AA Efros, M Hebert",Automatic photo pop-up,982,2005, dl.acm.org, ACM SIGGRAPH 2005 Papers,https://dl.acm.org/doi/abs/10.1145/1186822.1073232,49
84,"…, S Wongwises, T Hayat, A Kolanjiyil, A Kasaeian, I Pop",Recent advances in modeling and simulation of nanofluid flows-Part I: Fundamentals and theory,972,2019, Elsevier, Physics reports,https://www.sciencedirect.com/science/article/pii/S0370157318303302,162
91,"…, JE Allen, JD Selengut, HL Koo, JD Peterson, M Pop…",Genome sequence and comparative analysis of the model rodent malaria parasite Plasmodium yoelii yoelii,915,2002, nature.com, Nature,https://www.nature.com/articles/nature01099,40
90,"…, AL Delcher, M Roberts, G Marçais, M Pop…",GAGE: A critical evaluation of genome assemblies and assembly algorithms,896,2012, genome.cshlp.org, Genome …,https://genome.cshlp.org/content/22/3/557.short,69
93,"E Pop, S Sinha, KE Goodson",Heat generation and transport in nanometer-scale transistors,822,2006, ieeexplore.ieee.org, Proceedings of the IEEE,https://ieeexplore.ieee.org/abstract/document/1705144/,43
94,"…, M Monchi, H Petit, S Baleynaud, C Chauvel, C Pop…",Low-gradient aortic stenosis: operative risk stratification and predictors for long-term outcome: a multicenter study using dobutamine stress hemodynamics,808,2003, Am Heart Assoc, Circulation,https://www.ahajournals.org/doi/abs/10.1161/01.Cir.0000079171.43055.46,37
68,"S Frith, A Goodwin","On record: rock, pop and the written word",787,2006, taylorfrancis.com,,https://www.taylorfrancis.com/books/mono/10.4324/9780203993026/record-simon-frith-andrew-goodwin,41
97,"…, RA Edwards, S Saha, VC Piro, BY Renard, M Pop…",Critical assessment of metagenome interpretation—a benchmark of metagenomics software,786,2017, nature.com, Nature …,https://www.nature.com/articles/nmeth.4458,98
3,"S Frith, H Horne",Art into pop,752,2016, taylorfrancis.com,,https://www.taylorfrancis.com/books/mono/10.4324/9781315624129/art-pop-simon-frith-howard-horne,84
100,"…, S Levy, K Remington, DB Rusch, AL Delcher, M Pop…",The dog genome: survey sequencing and comparative analysis,732,2003, science.org, Science,https://www.science.org/doi/abs/10.1126/science.1086432,33
98,"C Pop, T Cioara, M Antal, I Anghel, I Salomie…",Blockchain based decentralized management of demand response programs in smart energy grids,720,2018, mdpi.com, Sensors,https://www.mdpi.com/1424-8220/18/1/162,103
99,"SD Harris, DB Ingham, I Pop",Mixed convection boundary-layer flow near the stagnation point on a vertical surface in a porous medium: Brinkman model with slip,717,2009, Springer, Transport in Porous Media,https://link.springer.com/article/10.1007/s11242-008-9309-6,45
40,M Wallace,Invisibility blues: From pop to theory,716,1990, books.google.com,,https://books.google.com/books?hl=en&lr=&id=0Z_rdEwTpiUC&oi=fnd&pg=PR9&dq=POP&ots=p6Jb-iVEjf&sig=baoixDuWrkjEY4ERU-Wqd2K5P0Y,20
60,"R Lohmann, K Breivik, J Dachs, D Muir",Global fate of POPs: current and future research directions,676,2007, Elsevier, Environmental pollution,https://www.sciencedirect.com/science/article/pii/S0269749107003028,38
92,"RA Pop, Z Săplăcan, DC Dabija…",The impact of social media influencers on travel decisions: The role of trust in consumer decision journey,672,2022, Taylor & Francis, Current Issues in Tourism,https://www.tandfonline.com/doi/abs/10.1080/13683500.2021.1895729,224
33,"N Nagarajan, M Pop",Sequence assembly demystified,651,2013, nature.com, Nature Reviews Genetics,https://www.nature.com/articles/nrg3367,54
70,"M Lanza, HSP Wong, E Pop, D Ielmini…",Recommended methods to study resistive switching devices,620,2019, Wiley Online Library, Advanced Electronic …,https://onlinelibrary.wiley.com/doi/abs/10.1002/aelm.201800143,103
87,"AM Pisoschi, A Pop, F Iordache, L Stanca…",Oxidative stress mitigation by antioxidants-an overview on their chemistry and influences on health status,620,2021, Elsevier, European Journal of …,https://www.sciencedirect.com/science/article/pii/S0223523420308631,155
61,"S Das, A Sebastian, E Pop, CJ McClellan…",Transistors based on two-dimensional materials for future integrated circuits,578,2021, nature.com, Nature …,https://www.nature.com/articles/s41928-021-00670-1,144
88,"…, SL Rauch, S Gilbody, S Moritz, T Berger, V Pop…",Internet-based cognitive behavioral therapy for depression: a systematic review and individual patient data network meta-analysis,536,2021, jamanetwork.com, JAMA …,https://jamanetwork.com/journals/jamapsychiatry/article-abstract/2774861,134
41,S Redhead,The end of the century party: Youth and pop towards 2000,522,1990, books.google.com,,https://books.google.com/books?hl=en&lr=&id=YsVRAQAAIAAJ&oi=fnd&pg=PA1&dq=POP&ots=ESCByTuX6W&sig=xttALnVvS_4pnz9Se-HyJgOHXD4,15
51,"G Mazzoleni, A Sfardini",Politica pop,447,2009, academia.edu, Il Mulino  Bologna,https://www.academia.edu/download/36219637/2009_-_Barra_e_Scaglioni_-_Appendice_-_Politica_pop.pdf,28
82,"…, C Mistodie, I Szilagyi, A Filimon, NM Mindrescu, L Pop…","Tirzepatide versus insulin glargine in type 2 diabetes and increased cardiovascular risk (SURPASS-4): a randomised, open-label, parallel-group, multicentre, phase 3 …",444,2021, thelancet.com, The Lancet,https://www.thelancet.com/journals/lancet/article/PIIS0140-6736(21)02188-7/fulltext,111
63,"V Pop, HJ Bergveld, PHL Notten…",State-of-the-art of battery state-of-charge determination,405,2005, iopscience.iop.org, … science and technology,https://iopscience.iop.org/article/10.1088/0957-0233/16/12/R01/meta,20
35,A Hennion,The production of success: an anti-musicology of the pop song,400,1983, cambridge.org, Popular Music,https://www.cambridge.org/core/journals/popular-music/article/production-of-success-an-antimusicology-of-the-pop-song/ED7D255EBFF1A0B5014DB6B68DA87E2B,10
12,T Murphey,The discourse of pop songs,331,1992, JSTOR, TESOL quarterly,https://www.jstor.org/stable/3586887,10
20,"S Frith, W Straw, J Street",The Cambridge companion to pop and rock,323,2001, books.google.com,,https://books.google.com/books?hl=en&lr=&id=5pxTb3YtB-gC&oi=fnd&pg=PR6&dq=POP&ots=fzrq5p-bJ7&sig=xccPgzZW27Khs1qwyQWVu3nAyiA,13
11,S Hawkins,Settling the pop score: Pop texts and identity politics,314,2017, taylorfrancis.com,,https://www.taylorfrancis.com/books/mono/10.4324/9781315088105/settling-pop-score-stan-hawkins,39
50,"JP Whitney, PS Sreetharan, KY Ma…",Pop-up book MEMS,296,2011, iopscience.iop.org, … of Micromechanics and …,https://iopscience.iop.org/article/10.1088/0960-1317/21/11/115021/meta,21
13,"R Cellini, A Soci",Pop competitiveness,259,2002, rosa.uniroma1.it, PSL Quarterly Review,https://rosa.uniroma1.it/rosa04/psl_quarterly_review/article/view/9905,11
96,"…, Z Ni, J Li, X Duan, P Wang, Y Nie, H Qiu, Y Shi, E Pop…",Approaching the quantum limit in two-dimensional semiconductor contacts,250,2023, nature.com, Nature,https://www.nature.com/articles/s41586-022-05431-4,125
4,T Osterwold,Pop art,242,2003, books.google.com,,https://books.google.com/books?hl=en&lr=&id=hRsFjSHBuKUC&oi=fnd&pg=PA6&dq=POP&ots=kqhF7FX1aF&sig=ppbjbvUrDVIvhQpcu1RQ6gshbO0,11
74,F Pop,Embedding problems over large fields,239,1996, JSTOR, Annals of Mathematics,https://www.jstor.org/stable/2118581,8
47,H Jenkins,Pop cosmopolitanism,232,2004, degruyter.com, Globalization: Culture and education in the new …,https://www.degruyter.com/document/doi/10.1525/9780520930964-008/pdf?licenseType=restricted,11
7,PA Duff,Media & pop culture,204,2002, academia.edu, J. Adolesc. Adult Lit,https://www.academia.edu/download/58283389/Duff_2002_JAAL_article_pop_culture.pdf,9
37,"R Gutman, C Maher",Uterine-preserving POP surgery,197,2013, Springer, International urogynecology journal,https://link.springer.com/article/10.1007/s00192-013-2171-2,16
64,"D Hatch, S Millward",From blues to rock: An analytical history of pop music,188,1987, books.google.com,,https://books.google.com/books?hl=en&lr=&id=FyO8AAAAIAAJ&oi=fnd&pg=PP9&dq=POP&ots=wN3FVeF61T&sig=xe_9_HDO2KQjYkgmSrrQ9Ta4oOY,5
6,S Jones,Pop music and the press,186,2002, books.google.com,,https://books.google.com/books?hl=en&lr=&id=N-ViwZnnR3oC&oi=fnd&pg=PR9&dq=POP&ots=tA94RiQi1P&sig=3KFJvZgoWpPFI1GIRTUi28ZyQt8,8
15,G Melly,Revolt into style: The pop arts,182,2012, books.google.com,,https://books.google.com/books?hl=en&lr=&id=kaaFgdMTuGsC&oi=fnd&pg=PT5&dq=POP&ots=uCDPQKNT20&sig=UZCnejXP80hhw4XarF9cMd4R0d0,14
25,PM Hirsch,Sociological approaches to the pop music phenomenon,180,1971, journals.sagepub.com, American Behavioral Scientist,https://journals.sagepub.com/doi/abs/10.1177/000276427101400310,3
38,"H Jenkins III, J Shattuc, T McPherson",Hop on pop: The politics and pleasures of popular culture,162,2003, books.google.com,,https://books.google.com/books?hl=en&lr=&id=ZZSz3ThOv9gC&oi=fnd&pg=PR2&dq=POP&ots=VmfsV70xHr&sig=bT8ZuhTbXI6wYbFQc33qtwd3Bp8,7
17,SH Madoff,Pop art: Critical History,155,1997, books.google.com,,https://books.google.com/books?hl=en&lr=&id=pbcwDwAAQBAJ&oi=fnd&pg=PR9&dq=POP&ots=XE3Xqmz5pH&sig=kiFm8cCBybpmW-lcqWyuS0fG5Ds,6
26,L Grossberg,Putting the pop back into postmodernism,150,1989, JSTOR, Social Text,https://www.jstor.org/stable/827814,4
18,M Cloonan,Pop and the nation-state: towards a theorisation,144,1999, cambridge.org, Popular music,https://www.cambridge.org/core/journals/popular-music/article/pop-and-the-nationstate-towards-a-theorisation/DE4E12DBF72847A516656831798094FD,6
1,T Delaney,Pop culture: An overview,143,2007, mkishseng1314c.pbworks.com, Philosophy Now,http://mkishseng1314c.pbworks.com/w/file/fetch/85849027/Pop%20Culture.docx,8
24,T Hecken,Pop: Geschichte eines Konzepts 1955-2009,143,2009, degruyter.com,,https://www.degruyter.com/document/doi/10.1515/9783839409824-ref/html,9
2,C Rojek,"Pop music, pop culture",142,2011, books.google.com,,https://books.google.com/books?hl=en&lr=&id=u_FYpzAljCUC&oi=fnd&pg=PP1&dq=POP&ots=-ldncQgTA4&sig=CHMAtF2TMDdN5dDiSWhuSau91Ko,10
46,"C Madhu, S Swift, S Moloney‐Geany…",How to use the pelvic organ prolapse quantification (POP‐Q) system?,133,2018, Wiley Online Library, Neurourology and …,https://onlinelibrary.wiley.com/doi/abs/10.1002/nau.23740,19
89,"Y Ren, J He, X Tan, T Qin, Z Zhao, TY Liu",Popmag: Pop music accompaniment generation,127,2020, dl.acm.org, Proceedings of the 28th ACM …,https://dl.acm.org/doi/abs/10.1145/3394171.3413721,25
72,D Railton,The gendered carnival of pop,126,2001, cambridge.org, Popular music,https://www.cambridge.org/core/journals/popular-music/article/gendered-carnival-of-pop/FC89BB41C6F6A475F1ACA4922EFDB471,5
27,"HM Berger, MT Carroll","Global pop, local language",121,2003, books.google.com,,https://books.google.com/books?hl=en&lr=&id=AQWyMWVV9IAC&oi=fnd&pg=PR7&dq=POP&ots=07a9bJcLRz&sig=SLSrYeqJnCMKF73MIhX8NFz3aWA,6
31,"R Oberdieck, NA Diangelakis…",Pop–parametric optimization toolbox,111,2016, ACS Publications, Industrial & …,https://pubs.acs.org/doi/abs/10.1021/acs.iecr.6b01913,12
22,S Fedorak,Pop culture: The culture of everyday life,106,2009, books.google.com,,https://books.google.com/books?hl=en&lr=&id=LqFtRaN6mUsC&oi=fnd&pg=PA1895&dq=POP&ots=5_H9O2WB8V&sig=72uiRmbDpkFA6Z9er7G4sinQssE,7
5,K Honnef,Pop art,103,2004, books.google.com,,https://books.google.com/books?hl=en&lr=&id=KRtCl1nFSV8C&oi=fnd&pg=PA5&dq=POP&ots=DxpiKX8QAn&sig=qIFUtvgPlf22TPrt05lcTjKMXAc,5
9,JA Walker,Cross-overs: Art into pop/pop into art,99,2023, taylorfrancis.com,,https://www.taylorfrancis.com/books/mono/10.4324/9781003420460/cross-overs-john-walker,50
23,C Whiting,Pop LA: Art and the City in the 1960s,99,2008, books.google.com,,https://books.google.com/books?hl=en&lr=&id=IezzI4AFRtAC&oi=fnd&pg=PR9&dq=POP&ots=0maW11CFXW&sig=HXpFiy_EnnrD9Hj2DPWG058YF1o,6
30,B Wheeler,POP.,66,2005, go.gale.com, Globe & Mail (Toronto  Canada),https://go.gale.com/ps/i.do?id=GALE%7CA135973534&sid=googleScholar&v=2.1&it=r&linkaccess=abs&issn=03190714&p=AONE&sw=w,3
32,RC Bump,The POP-Q system: two decades of progress and debate,53,2014, Springer, International urogynecology journal,https://link.springer.com/article/10.1007/s00192-013-2262-0,5
21,A Bradley,The poetry of pop,46,2017, books.google.com,,https://books.google.com/books?hl=en&lr=&id=L808DgAAQBAJ&oi=fnd&pg=PP1&dq=POP&ots=uDMf7qKYpq&sig=uv6Dx_GKA_0B0fJwcLS6Srz2GAs,6
16,"H Stefan, F Allmer, K Schalek, J Eberl, R Hansmann…",POP-PraxisOrientierte Pflegediagnostik,40,2013, Springer,,https://link.springer.com/content/pdf/10.1007/978-3-662-62673-3.pdf,3
76,DS Brown,"On pop art, permissiveness, and planning",39,1969, Taylor & Francis, Journal of the American Institute of Planners,https://www.tandfonline.com/doi/abs/10.1080/01944366908977950,1
29,R Rosenblum,Pop art and non-pop art,34,1965, degruyter.com, Art and Literature,https://www.degruyter.com/document/doi/10.1525/9780520920477-035/pdf?licenseType=restricted,1
36,L Hirschberg,MIA's Agitprop Pop,27,2010, go.gale.com, The New York Times Magazine,https://go.gale.com/ps/i.do?id=GALE%7CA227696943&sid=googleScholar&v=2.1&it=r&linkaccess=abs&issn=00287822&p=LitRC&sw=w,2
95,"…, CG Radu-Rusu, D Simeanu, D Mierliță, IM Pop",Persistent organic pollutants (POPs): a review focused on occurrence and incidence in animal feed and cow milk,13,2023, mdpi.com, Agriculture,https://www.mdpi.com/2077-0472/13/4/873,6
